{
    "title": "SELECT Uva problems that contain 'e' ",
    "query": "e",
    "plateform": "uva",
    "response": {
        "code": 200,
        "body": {
            "result": [
                {
                    "id": 36,
                    "name": "100 – The 3n + 1 problem",
                    "plateform": "Uva",
                    "link": "https://uva.onlinejudge.org/index.php?option=onlinejudge&page=show_problem&problem=36"
                },
                {
                    "id": 37,
                    "name": "101 - The Block Problem",
                    "plateform": "Uva",
                    "link": "https://uva.onlinejudge.org/index.php?option=onlinejudge&page=show_problem&problem=37"
                },
                {
                    "id": 38,
                    "name": "102 – Ecological Bin Packing",
                    "plateform": "Uva",
                    "link": "https://uva.onlinejudge.org/index.php?option=onlinejudge&page=show_problem&problem=38"
                },
                {
                    "id": 39,
                    "name": "103 – Stacking Boxes",
                    "plateform": "Uva",
                    "link": "https://uva.onlinejudge.org/index.php?option=onlinejudge&page=show_problem&problem=39"
                },
                {
                    "id": 40,
                    "name": "104 – Arbitrage",
                    "plateform": "Uva",
                    "link": "https://uva.onlinejudge.org/index.php?option=onlinejudge&page=show_problem&problem=40"
                },
                {
                    "id": 41,
                    "name": "105 – The Skyline Problem",
                    "plateform": "Uva",
                    "link": "https://uva.onlinejudge.org/index.php?option=onlinejudge&page=show_problem&problem=41"
                },
                {
                    "id": 42,
                    "name": "106 – Fermat vs. Pythagoras",
                    "plateform": "Uva",
                    "link": "https://uva.onlinejudge.org/index.php?option=onlinejudge&page=show_problem&problem=42"
                },
                {
                    "id": 43,
                    "name": "107 – The Cat in the Hat",
                    "plateform": "Uva",
                    "link": "https://uva.onlinejudge.org/index.php?option=onlinejudge&page=show_problem&problem=43"
                },
                {
                    "id": 45,
                    "name": "109 – SCUD Busters",
                    "plateform": "Uva",
                    "link": "https://uva.onlinejudge.org/index.php?option=onlinejudge&page=show_problem&problem=45"
                },
                {
                    "id": 46,
                    "name": "110 – Meta-Loopless Sorts",
                    "plateform": "Uva",
                    "link": "https://uva.onlinejudge.org/index.php?option=onlinejudge&page=show_problem&problem=46"
                },
                {
                    "id": 48,
                    "name": "112 – Tree Summing",
                    "plateform": "Uva",
                    "link": "https://uva.onlinejudge.org/index.php?option=onlinejudge&page=show_problem&problem=48"
                },
                {
                    "id": 49,
                    "name": "113 – Power of Cryptography",
                    "plateform": "Uva",
                    "link": "https://uva.onlinejudge.org/index.php?option=onlinejudge&page=show_problem&problem=49"
                },
                {
                    "id": 51,
                    "name": "115 – Climbing Trees",
                    "plateform": "Uva",
                    "link": "https://uva.onlinejudge.org/index.php?option=onlinejudge&page=show_problem&problem=51"
                },
                {
                    "id": 52,
                    "name": "116 – Unidirectional TSP",
                    "plateform": "Uva",
                    "link": "https://uva.onlinejudge.org/index.php?option=onlinejudge&page=show_problem&problem=52"
                },
                {
                    "id": 53,
                    "name": "117 - The Postal Worker Rings Once",
                    "plateform": "Uva",
                    "link": "https://uva.onlinejudge.org/index.php?option=onlinejudge&page=show_problem&problem=53"
                },
                {
                    "id": 54,
                    "name": "118 - Mutant Flatworld Explorers",
                    "plateform": "Uva",
                    "link": "https://uva.onlinejudge.org/index.php?option=onlinejudge&page=show_problem&problem=54"
                },
                {
                    "id": 55,
                    "name": "119 - Greedy Gift Givers",
                    "plateform": "Uva",
                    "link": "https://uva.onlinejudge.org/index.php?option=onlinejudge&page=show_problem&problem=55"
                },
                {
                    "id": 57,
                    "name": "121 - Pipe Fitters",
                    "plateform": "Uva",
                    "link": "https://uva.onlinejudge.org/index.php?option=onlinejudge&page=show_problem&problem=57"
                },
                {
                    "id": 58,
                    "name": "122 - Trees on the level",
                    "plateform": "Uva",
                    "link": "https://uva.onlinejudge.org/index.php?option=onlinejudge&page=show_problem&problem=58"
                },
                {
                    "id": 59,
                    "name": "123 - Searching Quickly",
                    "plateform": "Uva",
                    "link": "https://uva.onlinejudge.org/index.php?option=onlinejudge&page=show_problem&problem=59"
                },
                {
                    "id": 60,
                    "name": "124 - Following Orders",
                    "plateform": "Uva",
                    "link": "https://uva.onlinejudge.org/index.php?option=onlinejudge&page=show_problem&problem=60"
                },
                {
                    "id": 61,
                    "name": "125 - Numbering Paths",
                    "plateform": "Uva",
                    "link": "https://uva.onlinejudge.org/index.php?option=onlinejudge&page=show_problem&problem=61"
                },
                {
                    "id": 62,
                    "name": "126 - The Errant Physicist",
                    "plateform": "Uva",
                    "link": "https://uva.onlinejudge.org/index.php?option=onlinejudge&page=show_problem&problem=62"
                },
                {
                    "id": 63,
                    "name": "127 - “Accordian” Patience",
                    "plateform": "Uva",
                    "link": "https://uva.onlinejudge.org/index.php?option=onlinejudge&page=show_problem&problem=63"
                },
                {
                    "id": 64,
                    "name": "128 - Software CRC",
                    "plateform": "Uva",
                    "link": "https://uva.onlinejudge.org/index.php?option=onlinejudge&page=show_problem&problem=64"
                }
            ]
        }
    }
}