{
    "title": "SELECT Uva problems that contain 'er' ",
    "query": "er",
    "plateform": "uva",
    "response": {
        "code": 200,
        "body": {
            "result": [
                {
                    "id": "42",
                    "name": "106 – Fermat vs. Pythagoras",
                    "plateform": "Uva",
                    "link": "https://uva.onlinejudge.org/index.php?option=onlinejudge&page=show_problem&problem=42"
                },
                {
                    "id": "45",
                    "name": "109 – SCUD Busters",
                    "plateform": "Uva",
                    "link": "https://uva.onlinejudge.org/index.php?option=onlinejudge&page=show_problem&problem=45"
                },
                {
                    "id": "49",
                    "name": "113 – Power of Cryptography",
                    "plateform": "Uva",
                    "link": "https://uva.onlinejudge.org/index.php?option=onlinejudge&page=show_problem&problem=49"
                },
                {
                    "id": "53",
                    "name": "117 - The Postal Worker Rings Once",
                    "plateform": "Uva",
                    "link": "https://uva.onlinejudge.org/index.php?option=onlinejudge&page=show_problem&problem=53"
                },
                {
                    "id": "54",
                    "name": "118 - Mutant Flatworld Explorers",
                    "plateform": "Uva",
                    "link": "https://uva.onlinejudge.org/index.php?option=onlinejudge&page=show_problem&problem=54"
                },
                {
                    "id": "55",
                    "name": "119 - Greedy Gift Givers",
                    "plateform": "Uva",
                    "link": "https://uva.onlinejudge.org/index.php?option=onlinejudge&page=show_problem&problem=55"
                },
                {
                    "id": "57",
                    "name": "121 - Pipe Fitters",
                    "plateform": "Uva",
                    "link": "https://uva.onlinejudge.org/index.php?option=onlinejudge&page=show_problem&problem=57"
                },
                {
                    "id": "60",
                    "name": "124 - Following Orders",
                    "plateform": "Uva",
                    "link": "https://uva.onlinejudge.org/index.php?option=onlinejudge&page=show_problem&problem=60"
                },
                {
                    "id": "61",
                    "name": "125 - Numbering Paths",
                    "plateform": "Uva",
                    "link": "https://uva.onlinejudge.org/index.php?option=onlinejudge&page=show_problem&problem=61"
                },
                {
                    "id": "62",
                    "name": "126 - The Errant Physicist",
                    "plateform": "Uva",
                    "link": "https://uva.onlinejudge.org/index.php?option=onlinejudge&page=show_problem&problem=62"
                }
            ]
        }
    }
}