{
    "title": "SELECT Live Archive hard problems",
    "query": "hard",
    "plateform": "livearchive",
    "response": {
        "code": 200,
        "body": {
            "result": [
                {
                    "id": "1",
                    "name": "2000 – Wrap it up",
                    "plateform": "Live Archive",
                    "link": "https://icpcarchive.ecs.baylor.edu/index.php?option=onlinejudge&page=show_problem&problem=1"
                },
                {
                    "id": "2",
                    "name": "2001 - Compiler code generation",
                    "plateform": "Live Archive",
                    "link": "https://icpcarchive.ecs.baylor.edu/index.php?option=onlinejudge&page=show_problem&problem=2"
                },
                {
                    "id": "3",
                    "name": "2002 – Crosswords",
                    "plateform": "Live Archive",
                    "link": "https://icpcarchive.ecs.baylor.edu/index.php?option=onlinejudge&page=show_problem&problem=3"
                },
                {
                    "id": "4",
                    "name": "2003 - Genetic family tree",
                    "plateform": "Live Archive",
                    "link": "https://icpcarchive.ecs.baylor.edu/index.php?option=onlinejudge&page=show_problem&problem=4"
                },
                {
                    "id": "5",
                    "name": "2004 - Fire trucks",
                    "plateform": "Live Archive",
                    "link": "https://icpcarchive.ecs.baylor.edu/index.php?option=onlinejudge&page=show_problem&problem=5"
                },
                {
                    "id": "10",
                    "name": "2009 - Best Image Layout",
                    "plateform": "Live Archive",
                    "link": "https://icpcarchive.ecs.baylor.edu/index.php?option=onlinejudge&page=show_problem&problem=10"
                },
                {
                    "id": "11",
                    "name": "2010 - Swiss Draw",
                    "plateform": "Live Archive",
                    "link": "https://icpcarchive.ecs.baylor.edu/index.php?option=onlinejudge&page=show_problem&problem=11"
                },
                {
                    "id": "12",
                    "name": "2011 – Calypso",
                    "plateform": "Live Archive",
                    "link": "https://icpcarchive.ecs.baylor.edu/index.php?option=onlinejudge&page=show_problem&problem=12"
                },
                {
                    "id": "13",
                    "name": "2012 - Four in a Line",
                    "plateform": "Live Archive",
                    "link": "https://icpcarchive.ecs.baylor.edu/index.php?option=onlinejudge&page=show_problem&problem=13"
                },
                {
                    "id": "17",
                    "name": "2016 - Charity Begins at Home-page",
                    "plateform": "Live Archive",
                    "link": "https://icpcarchive.ecs.baylor.edu/index.php?option=onlinejudge&page=show_problem&problem=17"
                },
                {
                    "id": "19",
                    "name": "2018 - If it's a Javelin  Duck!",
                    "plateform": "Live Archive",
                    "link": "https://icpcarchive.ecs.baylor.edu/index.php?option=onlinejudge&page=show_problem&problem=19"
                },
                {
                    "id": "20",
                    "name": "2019 - The Party's in Dolores's Driveway",
                    "plateform": "Live Archive",
                    "link": "https://icpcarchive.ecs.baylor.edu/index.php?option=onlinejudge&page=show_problem&problem=20"
                },
                {
                    "id": "21",
                    "name": "2020 - Programming Olympiad",
                    "plateform": "Live Archive",
                    "link": "https://icpcarchive.ecs.baylor.edu/index.php?option=onlinejudge&page=show_problem&problem=21"
                },
                {
                    "id": "23",
                    "name": "2022 - The Plane Problem",
                    "plateform": "Live Archive",
                    "link": "https://icpcarchive.ecs.baylor.edu/index.php?option=onlinejudge&page=show_problem&problem=23"
                },
                {
                    "id": "24",
                    "name": "2023 - Who Wants to Have the Fastest Fingers?",
                    "plateform": "Live Archive",
                    "link": "https://icpcarchive.ecs.baylor.edu/index.php?option=onlinejudge&page=show_problem&problem=24"
                },
                {
                    "id": "25",
                    "name": "2024 – Convoy",
                    "plateform": "Live Archive",
                    "link": "https://icpcarchive.ecs.baylor.edu/index.php?option=onlinejudge&page=show_problem&problem=25"
                },
                {
                    "id": "26",
                    "name": "2025 - Digital Lab",
                    "plateform": "Live Archive",
                    "link": "https://icpcarchive.ecs.baylor.edu/index.php?option=onlinejudge&page=show_problem&problem=26"
                },
                {
                    "id": "29",
                    "name": "2028 - Treasure Hunt",
                    "plateform": "Live Archive",
                    "link": "https://icpcarchive.ecs.baylor.edu/index.php?option=onlinejudge&page=show_problem&problem=29"
                }
            ]
        }
    }
}
