{
    "title": "SELECT Codeforces problems that contain 'tree' ",
    "query": "tree",
    "plateform": "codeforces",
    "response": {
        "code": 200,
        "body": {
            "result": [
                {
                    "id": "1010",
                    "name": "F. Tree",
                    "plateform": "Codeforces",
                    "link": "https://codeforces.com/problemset/problem/1010/F"
                },
                {
                    "id": "438",
                    "name": "E. The Child and Binary Tree",
                    "plateform": "Codeforces",
                    "link": "https://codeforces.com/problemset/problem/438/E"
                }
            ]
        }
    }
}