{
    "title": "SELECT Live Archive problems that contain 'tree' ",
    "query": "tree",
    "plateform": "livearchive",
    "response": {
        "code": 200,
        "body": {
            "result": [
                {
                    "id": "4",
                    "name": "2003 - Genetic family tree",
                    "plateform": "Live Archive",
                    "link": "https://icpcarchive.ecs.baylor.edu/index.php?option=onlinejudge&page=show_problem&problem=4"
                }
            ]
        }
    }
}